{
  "$schema": "http://json-schema.org/draft-07/schema#",
  "$id": "https://matchdaypilot/site_v2/page-spec.schema.json",
  "title": "Matchday Pilot v2 page spec",
  "description": "One spec per page TEMPLATE (not per rendered instance). Declares the page's blocks, each block's backing dbt mart, the i18n keys it uses, and (since #844) its SEO surface, so a build-time checker can refuse to build a page with no spec or a spec that references something that does not exist. TWO checkers read this: scripts/check-page-specs.mjs at prebuild (declaration-time: does everything named here exist?) and scripts/audit-seo.mjs after astro build (output-time: does the EMITTED html match what was declared?). Shape rules are mirrored by hand in check-page-specs.mjs -- keep the two in sync; check-page-specs.test.mjs cross-checks them. See docs/content_architecture.md for the block library.",
  "type": "object",
  "required": ["page", "entity", "blocks", "seo"],
  "additionalProperties": false,
  "properties": {
    "page": {
      "type": "string",
      "description": "The page template's source path, relative to site_v2/src/pages/ (e.g. \"[lang]/teams/[team].astro\")."
    },
    "entity": {
      "type": "string",
      "enum": ["team", "player", "fixture", "competition", "competitionIndex", "home", "matchDay", "teamIndex"],
      "description": "The entity type this template renders, per docs/content_architecture.md section 2."
    },
    "stub": {
      "type": "boolean",
      "description": "TRUE only for a page that ships a real URL but has no content blocks yet (a scaffold). It waives the blocks requirement and NOTHING ELSE -- canonical, hreflang and a unique title are true facts about any URL that ships, so the seo block stays required. Every stub must be listed in src/config/indexability.mjs's STUB_PAGES, and the audit refuses to let INDEXABLE become true while that list is non-empty: a stub in the index is a thin page by definition."
    },
    "blocks": {
      "type": "array",
      "minItems": 1,
      "items": {
        "type": "object",
        "required": ["block", "mart"],
        "additionalProperties": false,
        "properties": {
          "block": {
            "type": "string",
            "description": "Block name, taken verbatim from the \"Block\" column of docs/content_architecture.md section 3 -- no new vocabulary."
          },
          "mart": {
            "oneOf": [
              { "type": "string" },
              { "type": "array", "minItems": 1, "items": { "type": "string" } }
            ],
            "description": "Where this block's data comes from, as \"type:name\" (or an array when one block genuinely has more than one source). An UNPREFIXED value means \"mart:\", so \"mart_team_profile\" and \"mart:mart_team_profile\" are the same thing and every spec written before 2026-08-03 keeps working. Known types, and what each resolves to: \"mart\" a file under dbt_project/models/5_marts/**; \"core\" a file under dbt_project/models/3_core/**; \"seed\" a .csv under dbt_project/seeds/; \"registry\" the competition registry (docs/competition_registry.yml, name \"competition_registry\"). Whatever the type, the named thing must EXIST -- that is the guarantee this field carries, and it did not change when the types were added. Types were generalised on a CPO ruling (2026-08-03) because the home page then had a browse block reading the competition registry, which the zero-file rule deliberately keeps out of the model layer, and its fixtures hero reads core.fct_fixture, the source the fixture page already uses; before that, the only way to satisfy this field was to duplicate the registry into a model. NOTE the browse block was DROPPED 2026-08-19, so \"registry\" currently has no declaring spec -- the type stays valid and supported (the zero-file rule that motivated it is unchanged, and the registry is still a legitimate source any future block may declare), but do not read this sentence as naming a live consumer. Adding a type is one entry in SOURCE_TYPES in check-page-specs.mjs. NOTE the field is still named \"mart\" for backwards compatibility; renaming it to \"source\" is a follow-up and a CPO naming call."
          },
          "i18n_keys": {
            "type": "array",
            "items": { "type": "string" },
            "description": "A representative (not required to be exhaustive) sample of i18n keys this block uses, from site_v2/src/i18n/strings.ts. Every LISTED key must exist in the EN dict."
          }
        }
      }
    },
    "seo": {
      "type": "object",
      "description": "The page's organic-search surface, DECLARED here and VERIFIED against the emitted dist/ (#844). CPO ruling: SEO is ensured while the site is built, not audited afterwards -- so no page builds without this block.",
      "required": ["canonical", "hreflang", "title", "description", "schema_org", "links", "minimum_data", "page_count_driver", "url_permanence"],
      "additionalProperties": false,
      "properties": {
        "canonical": {
          "type": "string",
          "enum": ["self"],
          "description": "\"self\": the page is its own canonical. Only value today. An alias/variant page pointing elsewhere needs the redirect mechanism (#843/#852) that does not exist yet, so any other value would be a promise nothing keeps."
        },
        "hreflang": {
          "type": "string",
          "enum": ["all-locales", "none"],
          "description": "\"all-locales\": one alternate per live locale plus x-default (which points at the en URL, never at the root redirect stub -- see site_architecture.md section 3). \"none\" only for a page with no locale segment."
        },
        "title": {
          "type": "string",
          "description": "The i18n key holding this page's <title> template, e.g. \"seoTeamTitle\". Must exist in the EN dict. Being a KEY rather than a literal is what forces the title through t() -- a concatenated title is locale-independent, which is how all three locales shipped byte-identical titles before #844."
        },
        "description": {
          "type": "string",
          "description": "The i18n key holding this page's <meta description> template. Same rule as title. NO NUMBERS until #838: `points` is a synthetic 3-1-0 tally, and a templated figure would write a known-false number into a surface search engines cache independently of the page."
        },
        "schema_org": {
          "type": "string",
          "description": "The schema.org @type this page's JSON-LD entity node must carry (e.g. \"SportsTeam\"). The audit parses the emitted @graph and fails if the type is absent. Format only -- whether the node is COMPLETE enough for a rich result is a separate content decision per entity."
        },
        "links": {
          "type": "object",
          "description": "The page's place in the internal link graph. SEO is a graph property, not a per-page one: a page nothing links to is a page nothing crawls.",
          "required": ["inbound_hub", "outbound"],
          "additionalProperties": false,
          "properties": {
            "inbound_hub": {
              "type": "string",
              "description": "The hub page type expected to link INTO this one (e.g. \"competition\"). \"none\" is allowed but is a declared orphan -- say so rather than omit it."
            },
            "outbound": {
              "type": "array",
              "items": { "type": "string" },
              "description": "Entity types this page links OUT to. The audit separately proves every emitted internal href resolves to a file the build produced; this declares the intent."
            }
          }
        },
        "minimum_data": {
          "type": "string",
          "description": "What a real entity must have before this page is generated at all (#845). Thin pages shrink crawl budget domain-wide -- 154,644 player pages of near-nothing would cost the whole domain. Free text until #845 settles the threshold, but it must be stated."
        },
        "page_count_driver": {
          "type": "string",
          "description": "A FORMULA over build inputs, not a constant -- the fixture count changes daily. e.g. \"teams in src/data/teams/ x locales\"."
        },
        "url_permanence": {
          "type": "string",
          "enum": ["permanent", "ephemeral"],
          "description": "A DECLARED FACT, not a promise. \"permanent\": this URL survives its entity's state changes. \"ephemeral\": it does not, and the reason belongs in url_permanence_note. Declared rather than assumed because fixture URLs are destroyed weeks after kickoff today (#861: only upcoming fixtures are exported), so a gate that simply REFUSED impermanent URLs would have failed the build on the fixture template the day it shipped -- blocking the gate on unrelated work instead of surfacing the defect."
        },
        "url_permanence_note": {
          "type": "string",
          "description": "Required in spirit whenever url_permanence is \"ephemeral\": what breaks, and which issue fixes it."
        }
      }
    }
  },
  "allOf": [
    {
      "if": { "properties": { "stub": { "const": true } }, "required": ["stub"] },
      "then": { "properties": { "blocks": { "minItems": 0 } } }
    }
  ]
}
